{
  "id": "coste-ubesse-moja-negra-tete-de-cuvee-2019",
  "producer_id": "domaine-coste-ubesse",
  "appellation_id": "aoc-pic-saint-loup",
  "name": "Moja Negra Tete de Cuvee",
  "color": "red",
  "vintage": 2019,
  "blend": [
    {
      "grape": "syrah",
      "pct": null
    },
    {
      "grape": "grenache",
      "pct": null
    }
  ],
  "abv": null,
  "aging": "5 semaines en cuves beton semi-enterrees, elevage separe des gouttes et des presses (13 mois) avant assemblage.",
  "price_eur": 25.0,
  "price_as_of": "2026-09-16",
  "organic": true,
  "certification": "Ecocert",
  "tasting_note": "Aromes de garrigue et de fleurs blanches de ciste. Le velours de la syrah, ses notes de reglisse, de fruits rouges et de violette, ponctuees d'un soupcon de pruneau apporte par le grenache.",
  "tasting_note_source": {
    "id": "page-coste-ubesse-moja-negra-tete-de-cuvee-2019",
    "type": "producer_page",
    "label": "Fiche cuvee publiee par le domaine",
    "url": "https://coste-ubesse.com/product/moja-negra-aop-pic-saint-loup-bio/",
    "authority": "Domaine Coste Ubesse",
    "retrieved_on": "2026-09-16"
  },
  "producer_pairings": [],
  "page_url": "https://coste-ubesse.com/product/moja-negra-aop-pic-saint-loup-bio/"
}
