{
  "id": "bergerie-du-capucin-dame-jeanne-rose-2025",
  "producer_id": "bergerie-du-capucin",
  "appellation_id": "aoc-pic-saint-loup",
  "name": "Dame Jeanne",
  "color": "rose",
  "vintage": 2025,
  "blend": [
    {
      "grape": "syrah",
      "pct": null
    },
    {
      "grape": "grenache",
      "pct": null
    },
    {
      "grape": "mourvedre",
      "pct": null
    }
  ],
  "abv": null,
  "aging": "Pressurage direct, vinification traditionnelle avec maitrise permanente de la temperature. Le mourvedre est vinifie a part.",
  "price_eur": 13.0,
  "price_as_of": "2026-09-16",
  "organic": true,
  "certification": null,
  "tasting_note": "Equilibre de fruits rouges frais et epices, aux aromes suaves et poivres. Issue des trois cepages du Pic Saint-Loup, syrah, grenache et mourvedre. Sols argilo-calcaires sur sous-sols marneux, vignes de 20 ans. A servir entre 10 et 11 C, a deguster dans les deux ans.",
  "tasting_note_source": {
    "id": "page-bergerie-du-capucin-dame-jeanne-rose-2025",
    "type": "producer_page",
    "label": "Fiche cuvee publiee par le domaine",
    "url": "https://bergerieducapucin.fr/fr/dame-jeanne/108-aop-dame-jeanne-rose-2024-75-cl.html",
    "authority": "Bergerie du Capucin",
    "retrieved_on": "2026-09-16"
  },
  "producer_pairings": [
    "grillades",
    "salades composees",
    "fromages",
    "poissons a la plancha",
    "plats epices"
  ],
  "page_url": "https://bergerieducapucin.fr/fr/dame-jeanne/108-aop-dame-jeanne-rose-2024-75-cl.html"
}
