{
  "id": "mas-foulaquier-picaleon-2024",
  "producer_id": "mas-foulaquier",
  "appellation_id": "aoc-pic-saint-loup",
  "name": "Picaleon",
  "color": "red",
  "vintage": 2024,
  "blend": [
    {
      "grape": "syrah",
      "pct": 50
    },
    {
      "grape": "grenache",
      "pct": 50
    }
  ],
  "abv": null,
  "aging": "Macerations douces et longues en infusion, sans intrants oenologiques. Cuvee labellisee Vin Methode Nature sans sulfites ajoutes.",
  "price_eur": 16.0,
  "price_as_of": "2026-09-16",
  "organic": null,
  "certification": null,
  "tasting_note": "Pic Saint-Loup plus leger que L'Orphee, alliant fruit et gourmandise grace a l'equilibre entre syrah et grenache. Terroir de Foulaquier, coteau d'eboulis calcaires sur argiles rouges au nord du Pic Saint-Loup, commune de Claret. Domaine conduit en biodynamie, vendange manuelle en caissettes de 20 kg.",
  "tasting_note_source": {
    "id": "page-mas-foulaquier-picaleon-2024",
    "type": "producer_page",
    "label": "Fiche cuvee publiee par le domaine",
    "url": "https://boutique.masfoulaquier.fr/products/picaleon-2024-pic-saint-loup-fruite-et-epice-17",
    "authority": "Mas Foulaquier",
    "retrieved_on": "2026-09-16"
  },
  "producer_pairings": [],
  "page_url": "https://boutique.masfoulaquier.fr/products/picaleon-2024-pic-saint-loup-fruite-et-epice-17"
}
