{
  "id": "estate-b-lines-les-terrasses-du-pic-2022",
  "producer_id": "estate-b-lines",
  "appellation_id": "aoc-pic-saint-loup",
  "name": "Les Terrasses du Pic",
  "color": "red",
  "vintage": 2022,
  "blend": [
    {
      "grape": "syrah",
      "pct": 55.0
    },
    {
      "grape": "grenache",
      "pct": 30.0
    },
    {
      "grape": "mourvedre",
      "pct": 15.0
    }
  ],
  "abv": 13.5,
  "aging": "12 mois en cuve inox puis 6 mois en bouteille",
  "price_eur": 15.8,
  "price_as_of": "2026-09-15",
  "organic": null,
  "certification": null,
  "tasting_note": "Nez expressif de cerise noire et de garrigue. Attaque souple, texture soyeuse, tanins fondus. La finale reste fraiche et mentholee.",
  "tasting_note_source": {
    "id": "sheet-estate-b-lines",
    "type": "tech_sheet",
    "label": "Fiche technique estate-b-lines",
    "url": "https://example.invalid/sheets/estate-b-lines.pdf",
    "retrieved_on": "2026-09-15"
  },
  "producer_pairings": [],
  "page_url": "https://example.invalid/sheets/estate-b-lines.pdf"
}
